{
  "schemaVersion": "neo.agent-child-run-canary-plan/v1",
  "synthetic": true,
  "userId": "00000000-0000-4000-8000-000000000004",
  "projectId": "project_00000004",
  "assistantId": "assistant_00000004",
  "model": {
    "provider": "fixture",
    "modelId": "fixture-model"
  },
  "packageFingerprint": "sha256:1111111111111111111111111111111111111111111111111111111111111111",
  "runtimeBundleFingerprint": "sha256:2222222222222222222222222222222222222222222222222222222222222222",
  "parentIdempotencyKey": "g21.4-child-canary-parent-template",
  "childIdempotencyKey": "g21.4-child-canary-child-template",
  "parentStepKind": "child_canary_parent",
  "childStepKind": "child_canary_work",
  "parentGrantId": "grant_0000000000000004",
  "delegationResource": "g21.4/synthetic-child",
  "grantWindowSeconds": 300,
  "childExpirySeconds": 120,
  "parentBudget": {
    "maxWallSeconds": 120,
    "maxModelTokens": 1000,
    "maxToolCalls": 2,
    "maxArtifactBytes": 8192
  },
  "childBudget": {
    "maxWallSeconds": 30,
    "maxModelTokens": 250,
    "maxToolCalls": 1,
    "maxArtifactBytes": 2048
  },
  "toolCatalog": [
    {
      "identity": "delegate_task",
      "capability": "delegate_task",
      "actions": [
        "create"
      ],
      "classification": "mutable",
      "idempotent": false
    }
  ],
  "parentRequestedTools": [
    "delegate_task"
  ],
  "childRequestedTools": [
    "delegate_task"
  ],
  "parentSandbox": {
    "runtimeBundleFingerprint": "sha256:2222222222222222222222222222222222222222222222222222222222222222",
    "packageFingerprint": "sha256:1111111111111111111111111111111111111111111111111111111111111111",
    "image": "registry.invalid/neo/child-canary@sha256:3333333333333333333333333333333333333333333333333333333333333333",
    "uid": 10001,
    "gid": 10001,
    "rootfsReadOnly": true,
    "noNewPrivileges": true,
    "capabilities": [],
    "seccompProfileFingerprint": "sha256:4444444444444444444444444444444444444444444444444444444444444444",
    "networkMode": "none",
    "workspaceSnapshotId": "workspace_snapshot_0000000000000004",
    "workspaceFingerprint": "sha256:5555555555555555555555555555555555555555555555555555555555555555",
    "resources": {
      "cpuMillis": 250,
      "memoryMiB": 128,
      "pids": 16,
      "wallSeconds": 120,
      "outputBytes": 4096,
      "scratchBytes": 1048576
    }
  },
  "childSandbox": {
    "runtimeBundleFingerprint": "sha256:2222222222222222222222222222222222222222222222222222222222222222",
    "packageFingerprint": "sha256:1111111111111111111111111111111111111111111111111111111111111111",
    "image": "registry.invalid/neo/child-canary@sha256:3333333333333333333333333333333333333333333333333333333333333333",
    "uid": 10001,
    "gid": 10001,
    "rootfsReadOnly": true,
    "noNewPrivileges": true,
    "capabilities": [],
    "seccompProfileFingerprint": "sha256:4444444444444444444444444444444444444444444444444444444444444444",
    "networkMode": "none",
    "workspaceSnapshotId": "workspace_snapshot_0000000000000005",
    "workspaceFingerprint": "sha256:6666666666666666666666666666666666666666666666666666666666666666",
    "resources": {
      "cpuMillis": 125,
      "memoryMiB": 64,
      "pids": 8,
      "wallSeconds": 30,
      "outputBytes": 2048,
      "scratchBytes": 1048576
    }
  },
  "parentArgv": [
    "/opt/neo/bin/child-canary-parent",
    "--wait-for-cancel"
  ],
  "childArgv": [
    "/opt/neo/bin/child-canary-child",
    "--wait-for-cancel"
  ],
  "parentLeaseSeconds": 120,
  "childLeaseSeconds": 30
}
